{
  "$schema": "../../../extension.schema.json",
  "$version": "1.0.0",
  "$name": "metadata-plugin",
  "$description": "metadata card configuration plugin - testing purpose",
  "features": {
    "content-metadata": [
      {
        "id": "app.content.metadata.presets",
        "disabled": true
      },
      {
        "id": "app.content.metadata.presets2",
        "presets": {
          "custom": [
            {
              "title": "testing extension props",
              "items": [
                {
                  "aspect": "exif:exif",
                  "properties": [
                    "exif:pixelXDimension",
                    "exif:pixelYDimension",
                    "exif:dateTimeOriginal"
                  ]
                }
              ]
            }
          ]
        }
      }
    ]
  }
}
